[
  {
    "atlas_path": "res://data/content_packs/base/assets/cosmetics/wanderer_default.png",
    "atlas_sha256": "59ec023b5557bb30e613ded3be7d725c78adc1212c1219c0726dc279287f3cf2",
    "availability": [
      "LAUNCH",
      "EXPANSION"
    ],
    "category": "cosmetic_definition",
    "character_id": "wanderer",
    "compatibility": {},
    "cosmetic_id": "wanderer.default",
    "description_key": "COSMETIC_ROUTE_DEFAULT",
    "effects": {},
    "id": "cosmetic_wanderer_default",
    "name_key": "COSMETIC_WANDERER_DEFAULT_NAME",
    "schema_version": 1,
    "tags": [
      "free",
      "appearance"
    ],
    "unlock_route": "default"
  },
  {
    "atlas_path": "res://data/content_packs/base/assets/cosmetics/wanderer_return.png",
    "atlas_sha256": "742b67cabe1f9343e013488bf0c197ff6aaa6ac0148b043544201e243725e226",
    "availability": [
      "LAUNCH",
      "EXPANSION"
    ],
    "category": "cosmetic_definition",
    "character_id": "wanderer",
    "compatibility": {},
    "cosmetic_id": "wanderer.return",
    "description_key": "COSMETIC_ROUTE_RETURN",
    "effects": {},
    "id": "cosmetic_wanderer_return",
    "name_key": "COSMETIC_WANDERER_RETURN_NAME",
    "schema_version": 1,
    "tags": [
      "free",
      "appearance"
    ],
    "unlock_route": "return"
  },
  {
    "atlas_path": "res://data/content_packs/base/assets/cosmetics/wanderer_victory.png",
    "atlas_sha256": "105842c8061a5e1e489d98ed5c567c8f9cd806c3d31e5ce2d969b29dfef31b22",
    "availability": [
      "LAUNCH",
      "EXPANSION"
    ],
    "category": "cosmetic_definition",
    "character_id": "wanderer",
    "compatibility": {},
    "cosmetic_id": "wanderer.victory",
    "description_key": "COSMETIC_ROUTE_VICTORY",
    "effects": {},
    "id": "cosmetic_wanderer_victory",
    "name_key": "COSMETIC_WANDERER_VICTORY_NAME",
    "schema_version": 1,
    "tags": [
      "free",
      "appearance"
    ],
    "unlock_route": "victory"
  },
  {
    "atlas_path": "res://data/content_packs/base/assets/cosmetics/time_guardian_default.png",
    "atlas_sha256": "d8505729de86621a1eba41e042d6bbe56b4aa05c9bb62fd88171387cd539216d",
    "availability": [
      "LAUNCH",
      "EXPANSION"
    ],
    "category": "cosmetic_definition",
    "character_id": "time_guardian",
    "compatibility": {},
    "cosmetic_id": "time_guardian.default",
    "description_key": "COSMETIC_ROUTE_DEFAULT",
    "effects": {},
    "id": "cosmetic_time_guardian_default",
    "name_key": "COSMETIC_TIME_GUARDIAN_DEFAULT_NAME",
    "schema_version": 1,
    "tags": [
      "free",
      "appearance"
    ],
    "unlock_route": "default"
  },
  {
    "atlas_path": "res://data/content_packs/base/assets/cosmetics/time_guardian_return.png",
    "atlas_sha256": "60a2fe5eac1e133db5abfaf7cb5d9b3cbb60ca3286cf203537084cd54ca808a8",
    "availability": [
      "LAUNCH",
      "EXPANSION"
    ],
    "category": "cosmetic_definition",
    "character_id": "time_guardian",
    "compatibility": {},
    "cosmetic_id": "time_guardian.return",
    "description_key": "COSMETIC_ROUTE_RETURN",
    "effects": {},
    "id": "cosmetic_time_guardian_return",
    "name_key": "COSMETIC_TIME_GUARDIAN_RETURN_NAME",
    "schema_version": 1,
    "tags": [
      "free",
      "appearance"
    ],
    "unlock_route": "return"
  },
  {
    "atlas_path": "res://data/content_packs/base/assets/cosmetics/time_guardian_victory.png",
    "atlas_sha256": "a0dc0318481634893ecd3db4e0cc966af605a7725bc2bfef93c2cf65345d9f01",
    "availability": [
      "LAUNCH",
      "EXPANSION"
    ],
    "category": "cosmetic_definition",
    "character_id": "time_guardian",
    "compatibility": {},
    "cosmetic_id": "time_guardian.victory",
    "description_key": "COSMETIC_ROUTE_VICTORY",
    "effects": {},
    "id": "cosmetic_time_guardian_victory",
    "name_key": "COSMETIC_TIME_GUARDIAN_VICTORY_NAME",
    "schema_version": 1,
    "tags": [
      "free",
      "appearance"
    ],
    "unlock_route": "victory"
  },
  {
    "atlas_path": "res://data/content_packs/base/assets/cosmetics/void_walker_default.png",
    "atlas_sha256": "01c9da0b126ef2e5a57f7436b8e0571a021cbc25a141a07b5b5ef8a40bf59835",
    "availability": [
      "LAUNCH",
      "EXPANSION"
    ],
    "category": "cosmetic_definition",
    "character_id": "void_walker",
    "compatibility": {},
    "cosmetic_id": "void_walker.default",
    "description_key": "COSMETIC_ROUTE_DEFAULT",
    "effects": {},
    "id": "cosmetic_void_walker_default",
    "name_key": "COSMETIC_VOID_WALKER_DEFAULT_NAME",
    "schema_version": 1,
    "tags": [
      "free",
      "appearance"
    ],
    "unlock_route": "default"
  },
  {
    "atlas_path": "res://data/content_packs/base/assets/cosmetics/void_walker_return.png",
    "atlas_sha256": "26001509b932d27aa6842595462463cc1b34c1fbcbf375dabd61e32b4b4688f3",
    "availability": [
      "LAUNCH",
      "EXPANSION"
    ],
    "category": "cosmetic_definition",
    "character_id": "void_walker",
    "compatibility": {},
    "cosmetic_id": "void_walker.return",
    "description_key": "COSMETIC_ROUTE_RETURN",
    "effects": {},
    "id": "cosmetic_void_walker_return",
    "name_key": "COSMETIC_VOID_WALKER_RETURN_NAME",
    "schema_version": 1,
    "tags": [
      "free",
      "appearance"
    ],
    "unlock_route": "return"
  },
  {
    "atlas_path": "res://data/content_packs/base/assets/cosmetics/void_walker_victory.png",
    "atlas_sha256": "848d67a46e875ff731e519939ce8fe1a68de1a9204832685075c3bab19392c9b",
    "availability": [
      "LAUNCH",
      "EXPANSION"
    ],
    "category": "cosmetic_definition",
    "character_id": "void_walker",
    "compatibility": {},
    "cosmetic_id": "void_walker.victory",
    "description_key": "COSMETIC_ROUTE_VICTORY",
    "effects": {},
    "id": "cosmetic_void_walker_victory",
    "name_key": "COSMETIC_VOID_WALKER_VICTORY_NAME",
    "schema_version": 1,
    "tags": [
      "free",
      "appearance"
    ],
    "unlock_route": "victory"
  },
  {
    "atlas_path": "res://data/content_packs/base/assets/cosmetics/primordial_knight_default.png",
    "atlas_sha256": "1bfc94af6a02fe543e0e3d7a4c3ec386a9ba8bdd22bdaef8ea1fa9b2491340ff",
    "availability": [
      "LAUNCH",
      "EXPANSION"
    ],
    "category": "cosmetic_definition",
    "character_id": "primordial_knight",
    "compatibility": {},
    "cosmetic_id": "primordial_knight.default",
    "description_key": "COSMETIC_ROUTE_DEFAULT",
    "effects": {},
    "id": "cosmetic_primordial_knight_default",
    "name_key": "COSMETIC_PRIMORDIAL_KNIGHT_DEFAULT_NAME",
    "schema_version": 1,
    "tags": [
      "free",
      "appearance"
    ],
    "unlock_route": "default"
  },
  {
    "atlas_path": "res://data/content_packs/base/assets/cosmetics/primordial_knight_return.png",
    "atlas_sha256": "22ecc1f67857795b38db9ce7ff192d3941af8292140b73641d045e81416b2337",
    "availability": [
      "LAUNCH",
      "EXPANSION"
    ],
    "category": "cosmetic_definition",
    "character_id": "primordial_knight",
    "compatibility": {},
    "cosmetic_id": "primordial_knight.return",
    "description_key": "COSMETIC_ROUTE_RETURN",
    "effects": {},
    "id": "cosmetic_primordial_knight_return",
    "name_key": "COSMETIC_PRIMORDIAL_KNIGHT_RETURN_NAME",
    "schema_version": 1,
    "tags": [
      "free",
      "appearance"
    ],
    "unlock_route": "return"
  },
  {
    "atlas_path": "res://data/content_packs/base/assets/cosmetics/primordial_knight_victory.png",
    "atlas_sha256": "3259bdedfcab7860e31c71be707b3efa15272ca54d7c8ad41eaddcb5de802544",
    "availability": [
      "LAUNCH",
      "EXPANSION"
    ],
    "category": "cosmetic_definition",
    "character_id": "primordial_knight",
    "compatibility": {},
    "cosmetic_id": "primordial_knight.victory",
    "description_key": "COSMETIC_ROUTE_VICTORY",
    "effects": {},
    "id": "cosmetic_primordial_knight_victory",
    "name_key": "COSMETIC_PRIMORDIAL_KNIGHT_VICTORY_NAME",
    "schema_version": 1,
    "tags": [
      "free",
      "appearance"
    ],
    "unlock_route": "victory"
  },
  {
    "atlas_path": "res://data/content_packs/base/assets/cosmetics/time_lord_default.png",
    "atlas_sha256": "f4d2ccbf4006c514b8b32b4240b5b46e6206d59d2441d47a561681aa4a0f8854",
    "availability": [
      "LAUNCH",
      "EXPANSION"
    ],
    "category": "cosmetic_definition",
    "character_id": "time_lord",
    "compatibility": {},
    "cosmetic_id": "time_lord.default",
    "description_key": "COSMETIC_ROUTE_DEFAULT",
    "effects": {},
    "id": "cosmetic_time_lord_default",
    "name_key": "COSMETIC_TIME_LORD_DEFAULT_NAME",
    "schema_version": 1,
    "tags": [
      "free",
      "appearance"
    ],
    "unlock_route": "default"
  },
  {
    "atlas_path": "res://data/content_packs/base/assets/cosmetics/time_lord_return.png",
    "atlas_sha256": "d444f7c27c97e151b123c88b8642aa246f2bb41dc0efacdf52654f095a2e6197",
    "availability": [
      "LAUNCH",
      "EXPANSION"
    ],
    "category": "cosmetic_definition",
    "character_id": "time_lord",
    "compatibility": {},
    "cosmetic_id": "time_lord.return",
    "description_key": "COSMETIC_ROUTE_RETURN",
    "effects": {},
    "id": "cosmetic_time_lord_return",
    "name_key": "COSMETIC_TIME_LORD_RETURN_NAME",
    "schema_version": 1,
    "tags": [
      "free",
      "appearance"
    ],
    "unlock_route": "return"
  },
  {
    "atlas_path": "res://data/content_packs/base/assets/cosmetics/time_lord_victory.png",
    "atlas_sha256": "f6fa93ffaf10f3bf825442414fe7bc92ee4a83b005953f0fc64a0f0f6277ae35",
    "availability": [
      "LAUNCH",
      "EXPANSION"
    ],
    "category": "cosmetic_definition",
    "character_id": "time_lord",
    "compatibility": {},
    "cosmetic_id": "time_lord.victory",
    "description_key": "COSMETIC_ROUTE_VICTORY",
    "effects": {},
    "id": "cosmetic_time_lord_victory",
    "name_key": "COSMETIC_TIME_LORD_VICTORY_NAME",
    "schema_version": 1,
    "tags": [
      "free",
      "appearance"
    ],
    "unlock_route": "victory"
  }
]
